{
  "$schema": "../../schema/product.schema.json",
  "product": "Jenkins",
  "slug": "jenkins",
  "vendor": "Jenkins",
  "category": "ci-cd",
  "homepage": "https://www.jenkins.io/",
  "aliases": [
    "jenkins ci",
    "jenkins controller"
  ],
  "tags": [
    "web",
    "ci-cd",
    "automation"
  ],
  "services": [
    "jenkins",
    "http"
  ],
  "ports": [
    8080
  ],
  "protocols": [
    "http",
    "https"
  ],
  "loginPaths": [
    "/login",
    "/"
  ],
  "sources": [
    "https://www.jenkins.io/doc/book/installing/linux/"
  ],
  "credentials": [
    {
      "username": "admin",
      "password": "",
      "versions": [
        "current"
      ],
      "status": "no-default",
      "context": "upstream",
      "confidence": "vendor-docs",
      "sourceType": "vendor-doc",
      "services": [
        "jenkins"
      ],
      "ports": [
        8080
      ],
      "protocols": [
        "http",
        "https"
      ],
      "loginPaths": [
        "/login",
        "/"
      ],
      "lastVerified": "2026-05-24",
      "notes": "Jenkins uses an initial administrator password generated on the server, not a fixed default password.",
      "scopeNote": "The generated password is commonly stored under the Jenkins home secrets directory and is required by the setup wizard.",
      "sources": [
        "https://www.jenkins.io/doc/book/installing/linux/"
      ]
    }
  ]
}
