{
  "$schema": "../../schema/product.schema.json",
  "product": "Portainer",
  "slug": "portainer",
  "vendor": "Portainer",
  "category": "container-management",
  "homepage": "https://www.portainer.io/",
  "aliases": ["portainer ce", "portainer community edition"],
  "tags": ["web", "docker", "containers", "management"],
  "services": ["portainer", "http"],
  "ports": [9000, 9443],
  "protocols": ["http", "https"],
  "loginPaths": ["/"],
  "sources": ["https://docs.portainer.io/start/install-ce/server/setup"],
  "credentials": [
    {
      "username": "admin",
      "password": "",
      "versions": ["current"],
      "status": "no-default",
      "context": "upstream",
      "confidence": "vendor-docs",
      "sourceType": "vendor-doc",
      "services": ["portainer"],
      "ports": [9000, 9443],
      "protocols": ["http", "https"],
      "loginPaths": ["/"],
      "lastVerified": "2026-05-24",
      "notes": "Initial setup defaults the first administrator username to admin, but the user must create a password.",
      "scopeNote": "No fixed default password is documented for a fresh Portainer setup.",
      "sources": ["https://docs.portainer.io/start/install-ce/server/setup"]
    }
  ]
}
