{
  "$schema": "../../schema/product.schema.json",
  "product": "mongo-express",
  "slug": "mongo-express",
  "vendor": "mongo-express",
  "category": "database-administration",
  "homepage": "https://github.com/mongo-express/mongo-express",
  "aliases": ["mongo express", "mongodb express", "mongo web admin"],
  "tags": ["web", "mongodb", "database", "admin", "docker"],
  "services": ["mongo-express", "http"],
  "ports": [8081],
  "protocols": ["http"],
  "loginPaths": ["/"],
  "sources": ["https://hub.docker.com/_/mongo-express"],
  "credentials": [
    {
      "username": "",
      "password": "",
      "versions": ["official docker image"],
      "status": "no-default",
      "context": "docker-image",
      "confidence": "vendor-docs",
      "sourceType": "vendor-doc",
      "services": ["mongo-express"],
      "ports": [8081],
      "protocols": ["http"],
      "loginPaths": ["/"],
      "lastVerified": "2026-05-24",
      "notes": "The official Docker image documents blank defaults for ME_CONFIG_BASICAUTH_USERNAME and ME_CONFIG_BASICAUTH_PASSWORD.",
      "scopeNote": "Basic authentication should be configured explicitly when exposing mongo-express.",
      "sources": ["https://hub.docker.com/_/mongo-express"]
    }
  ]
}
