{
  "$schema": "../../schema/product.schema.json",
  "product": "RabbitMQ",
  "slug": "rabbitmq",
  "vendor": "Broadcom / VMware Tanzu",
  "category": "message-broker",
  "homepage": "https://www.rabbitmq.com/",
  "aliases": [
    "rabbitmq management",
    "rabbitmq management ui"
  ],
  "tags": [
    "web",
    "queue",
    "message-broker",
    "management"
  ],
  "services": [
    "rabbitmq-management",
    "amqp"
  ],
  "ports": [
    15672,
    5672
  ],
  "protocols": [
    "http",
    "https",
    "amqp"
  ],
  "loginPaths": [
    "/"
  ],
  "sources": [
    "https://www.rabbitmq.com/docs/access-control",
    "https://www.rabbitmq.com/docs/management"
  ],
  "credentials": [
    {
      "username": "guest",
      "password": "guest",
      "versions": [
        "current"
      ],
      "status": "active",
      "context": "upstream",
      "confidence": "vendor-docs",
      "sourceType": "vendor-doc",
      "services": [
        "rabbitmq-management",
        "amqp"
      ],
      "ports": [
        15672,
        5672
      ],
      "protocols": [
        "http",
        "https",
        "amqp"
      ],
      "loginPaths": [
        "/"
      ],
      "lastVerified": "2026-05-24",
      "notes": "RabbitMQ creates a default guest user with password guest on a blank node.",
      "scopeNote": "By default the guest user can only connect from localhost; remote use is refused unless loopback restrictions are changed.",
      "sources": [
        "https://www.rabbitmq.com/docs/access-control"
      ]
    }
  ]
}
