{
  "$schema": "../../schema/product.schema.json",
  "product": "Elastic Kibana",
  "slug": "elastic-kibana",
  "vendor": "Elastic",
  "category": "search-analytics-dashboard",
  "homepage": "https://www.elastic.co/kibana",
  "aliases": ["kibana", "elastic stack", "elasticsearch"],
  "tags": ["web", "search", "analytics", "dashboard"],
  "services": ["kibana", "http"],
  "ports": [5601],
  "protocols": ["http", "https"],
  "loginPaths": ["/login", "/"],
  "sources": ["https://www.elastic.co/docs/deploy-manage/users-roles/cluster-or-deployment-auth/built-in-users"],
  "credentials": [
    {
      "username": "elastic",
      "password": "",
      "versions": ["current"],
      "status": "no-default",
      "context": "upstream",
      "confidence": "vendor-docs",
      "sourceType": "vendor-doc",
      "services": ["kibana"],
      "ports": [5601],
      "protocols": ["http", "https"],
      "loginPaths": ["/login", "/"],
      "lastVerified": "2026-05-24",
      "notes": "Elastic documentation states that the elastic user no longer has a default password and the password must be set before use.",
      "scopeNote": "Use the configured bootstrap or enrollment flow for the specific deployment.",
      "sources": ["https://www.elastic.co/docs/deploy-manage/users-roles/cluster-or-deployment-auth/built-in-users"]
    }
  ]
}
