{
  "$schema": "../../schema/product.schema.json",
  "product": "OpenSearch Dashboards",
  "slug": "opensearch-dashboards",
  "vendor": "OpenSearch Project",
  "category": "search-analytics-dashboard",
  "homepage": "https://opensearch.org/",
  "aliases": ["opensearch", "opensearch dashboard"],
  "tags": ["web", "search", "analytics", "dashboard"],
  "services": ["opensearch-dashboards", "http"],
  "ports": [5601],
  "protocols": ["http", "https"],
  "loginPaths": ["/"],
  "sources": ["https://opensearch.org/downloads/", "https://opensearch.org/blog/replacing-default-admin-credentials/"],
  "credentials": [
    {
      "username": "admin",
      "password": "admin",
      "versions": ["<= 2.11.1", "security demo configuration"],
      "status": "historical",
      "context": "sample-config",
      "confidence": "vendor-docs",
      "sourceType": "vendor-doc",
      "services": ["opensearch-dashboards"],
      "ports": [5601],
      "protocols": ["http", "https"],
      "loginPaths": ["/"],
      "lastVerified": "2026-05-24",
      "notes": "OpenSearch notes that the default admin password was removed starting in 2.12.0.",
      "scopeNote": "Applies to older security demo configurations; current fresh installs require a custom admin password.",
      "sources": ["https://opensearch.org/blog/replacing-default-admin-credentials/"]
    },
    {
      "username": "admin",
      "password": "",
      "versions": [">= 2.12.0"],
      "status": "no-default",
      "context": "upstream",
      "confidence": "vendor-docs",
      "sourceType": "vendor-doc",
      "services": ["opensearch-dashboards"],
      "ports": [5601],
      "protocols": ["http", "https"],
      "loginPaths": ["/"],
      "lastVerified": "2026-05-24",
      "notes": "Fresh installs require setting a custom admin password with OPENSEARCH_INITIAL_ADMIN_PASSWORD.",
      "scopeNote": "The current default username is admin, but the password is user-defined.",
      "sources": ["https://opensearch.org/downloads/", "https://opensearch.org/blog/replacing-default-admin-credentials/"]
    }
  ]
}
