{
  "$schema": "../../schema/product.schema.json",
  "product": "Zabbix",
  "slug": "zabbix",
  "vendor": "Zabbix",
  "category": "monitoring-platform",
  "homepage": "https://www.zabbix.com/",
  "aliases": [
    "zabbix frontend",
    "zabbix web"
  ],
  "tags": [
    "web",
    "monitoring",
    "dashboard"
  ],
  "services": [
    "zabbix-frontend",
    "http"
  ],
  "ports": [
    80,
    443
  ],
  "protocols": [
    "http",
    "https"
  ],
  "loginPaths": [
    "/zabbix/",
    "/"
  ],
  "sources": [
    "https://www.zabbix.com/documentation/current/en/manual/quickstart/login"
  ],
  "credentials": [
    {
      "username": "Admin",
      "password": "zabbix",
      "versions": [
        "current"
      ],
      "status": "active",
      "context": "upstream",
      "confidence": "vendor-docs",
      "sourceType": "vendor-doc",
      "services": [
        "zabbix-frontend"
      ],
      "ports": [
        80,
        443
      ],
      "protocols": [
        "http",
        "https"
      ],
      "loginPaths": [
        "/zabbix/",
        "/"
      ],
      "lastVerified": "2026-05-24",
      "notes": "Zabbix documentation lists Admin with password zabbix for the initial frontend login.",
      "scopeNote": "The username is case-sensitive in common deployments.",
      "sources": [
        "https://www.zabbix.com/documentation/current/en/manual/quickstart/login"
      ]
    }
  ]
}
