{
  "$schema": "../../schema/product.schema.json",
  "product": "MediaWiki",
  "slug": "mediawiki",
  "vendor": "MediaWiki",
  "category": "wiki",
  "homepage": "https://www.mediawiki.org/",
  "aliases": [
    "media wiki",
    "wikimedia software"
  ],
  "tags": [
    "web",
    "wiki",
    "php"
  ],
  "services": [
    "mediawiki",
    "http"
  ],
  "ports": [
    80,
    443
  ],
  "protocols": [
    "http",
    "https"
  ],
  "loginPaths": [
    "/index.php?title=Special:UserLogin",
    "/wiki/Special:UserLogin"
  ],
  "sources": [
    "https://www.mediawiki.org/wiki/Manual:Install.php"
  ],
  "credentials": [
    {
      "username": "",
      "password": "",
      "versions": [
        "current"
      ],
      "status": "no-default",
      "context": "upstream",
      "confidence": "vendor-docs",
      "sourceType": "vendor-doc",
      "services": [
        "mediawiki"
      ],
      "ports": [
        80,
        443
      ],
      "protocols": [
        "http",
        "https"
      ],
      "loginPaths": [
        "/index.php?title=Special:UserLogin",
        "/wiki/Special:UserLogin"
      ],
      "lastVerified": "2026-05-24",
      "notes": "MediaWiki installation requires specifying an administrator user and password.",
      "scopeNote": "No fixed application default username/password pair is documented for a fresh upstream install.",
      "sources": [
        "https://www.mediawiki.org/wiki/Manual:Install.php"
      ]
    }
  ]
}
