{
  "$schema": "../../schema/product.schema.json",
  "product": "Prometheus",
  "slug": "prometheus",
  "vendor": "Prometheus",
  "category": "monitoring-platform",
  "homepage": "https://prometheus.io/",
  "aliases": ["prometheus server", "prometheus ui"],
  "tags": ["web", "monitoring", "metrics"],
  "services": ["prometheus", "http"],
  "ports": [9090],
  "protocols": ["http", "https"],
  "loginPaths": ["/", "/graph", "/query"],
  "sources": ["https://prometheus.io/docs/prometheus/latest/command-line/prometheus/", "https://prometheus.io/docs/guides/basic-auth/"],
  "credentials": [
    {
      "username": "",
      "password": "",
      "versions": ["current"],
      "status": "no-default",
      "context": "upstream",
      "confidence": "vendor-docs",
      "sourceType": "vendor-doc",
      "services": ["prometheus"],
      "ports": [9090],
      "protocols": ["http", "https"],
      "loginPaths": ["/", "/graph", "/query"],
      "lastVerified": "2026-05-24",
      "notes": "Prometheus supports web authentication through an explicit web configuration file; no fixed default UI credentials are documented.",
      "scopeNote": "If no web authentication is configured, there is no username/password to test.",
      "sources": ["https://prometheus.io/docs/prometheus/latest/command-line/prometheus/", "https://prometheus.io/docs/guides/basic-auth/"]
    }
  ]
}
