{
  "$schema": "../../schema/product.schema.json",
  "product": "Apache Tomcat",
  "slug": "apache-tomcat",
  "vendor": "Apache",
  "category": "application-server",
  "homepage": "https://tomcat.apache.org/",
  "aliases": ["tomcat", "tomcat manager", "apache tomcat manager"],
  "tags": ["web", "java", "manager"],
  "services": ["tomcat-manager", "http"],
  "ports": [8080],
  "protocols": ["http", "https"],
  "loginPaths": ["/manager/html", "/host-manager/html"],
  "sources": ["https://tomcat.apache.org/"],
  "credentials": [
    {
      "username": "tomcat",
      "password": "tomcat",
      "versions": ["6.x", "7.x"],
      "status": "historical",
      "context": "ctf-lab",
      "confidence": "lab-only",
      "sourceType": "ctf",
      "services": ["tomcat-manager"],
      "ports": [8080],
      "protocols": ["http", "https"],
      "loginPaths": ["/manager/html"],
      "lastVerified": "2026-05-24",
      "notes": "Commonly encountered in labs and legacy examples. Verify against the target packaging and deployment source.",
      "scopeNote": "Use as a lab and legacy sample check, not as an upstream Tomcat default claim.",
      "sources": ["https://tomcat.apache.org/"]
    },
    {
      "username": "tomcat",
      "password": "s3cret",
      "versions": ["6.x", "7.x"],
      "status": "historical",
      "context": "ctf-lab",
      "confidence": "lab-only",
      "sourceType": "ctf",
      "services": ["tomcat-manager"],
      "ports": [8080],
      "protocols": ["http", "https"],
      "loginPaths": ["/manager/html"],
      "lastVerified": "2026-05-24",
      "notes": "Frequently used in training environments and legacy sample configurations.",
      "scopeNote": "Use as a lab and legacy sample check, not as an upstream Tomcat default claim.",
      "sources": ["https://tomcat.apache.org/"]
    },
    {
      "username": "",
      "password": "",
      "versions": ["8.x", "9.x", "10.x"],
      "status": "no-default",
      "context": "upstream",
      "confidence": "vendor-docs",
      "sourceType": "vendor-doc",
      "services": ["tomcat-manager"],
      "ports": [8080],
      "protocols": ["http", "https"],
      "loginPaths": ["/manager/html"],
      "lastVerified": "2026-05-24",
      "notes": "Stock upstream Tomcat does not create a default manager user.",
      "scopeNote": "Applies to upstream Tomcat manager users; downstream appliances or training images may differ.",
      "sources": ["https://tomcat.apache.org/tomcat-9.0-doc/manager-howto.html"]
    }
  ]
}
