{
  "$schema": "../../schema/product.schema.json",
  "product": "Jupyter Server",
  "slug": "jupyter-server",
  "vendor": "Project Jupyter",
  "category": "notebook-server",
  "homepage": "https://jupyter.org/",
  "aliases": [
    "jupyter notebook",
    "jupyter lab",
    "jupyterlab"
  ],
  "tags": [
    "web",
    "notebook",
    "python",
    "data-science"
  ],
  "services": [
    "jupyter-server",
    "http"
  ],
  "ports": [
    8888
  ],
  "protocols": [
    "http",
    "https"
  ],
  "loginPaths": [
    "/login",
    "/tree",
    "/lab"
  ],
  "sources": [
    "https://jupyter-server.readthedocs.io/en/latest/operators/security.html"
  ],
  "credentials": [
    {
      "username": "",
      "password": "",
      "versions": [
        "current"
      ],
      "status": "no-default",
      "context": "upstream",
      "confidence": "vendor-docs",
      "sourceType": "vendor-doc",
      "services": [
        "jupyter-server"
      ],
      "ports": [
        8888
      ],
      "protocols": [
        "http",
        "https"
      ],
      "loginPaths": [
        "/login",
        "/tree",
        "/lab"
      ],
      "lastVerified": "2026-05-24",
      "notes": "Jupyter Server generates a token by default; the token can be supplied in the URL, Authorization header, or login form password field.",
      "scopeNote": "No fixed username/password pair exists for a normal fresh upstream server.",
      "sources": [
        "https://jupyter-server.readthedocs.io/en/latest/operators/security.html"
      ]
    }
  ]
}
